{"attempts":[{"arm":"sequential","attemptId":"sample-warm-seq","pairNumber":0,"receiptDigest":"sha256:0000000000000000000000000000000000000000000000000000000000000000","terminalStatus":"green","workloadId":"sample"},{"arm":"parallel","attemptId":"sample-warm-par","pairNumber":0,"receiptDigest":"sha256:1111111111111111111111111111111111111111111111111111111111111111","terminalStatus":"green","workloadId":"sample"},{"arm":"sequential","attemptId":"sample-p1-seq","pairNumber":1,"receiptDigest":"sha256:2222222222222222222222222222222222222222222222222222222222222222","terminalStatus":"green","workloadId":"sample"},{"arm":"parallel","attemptId":"sample-p1-par","pairNumber":1,"receiptDigest":"sha256:3333333333333333333333333333333333333333333333333333333333333333","terminalStatus":"green","workloadId":"sample"},{"arm":"parallel","attemptId":"sample-p2-par","pairNumber":2,"receiptDigest":"sha256:4444444444444444444444444444444444444444444444444444444444444444","terminalStatus":"green","workloadId":"sample"},{"arm":"sequential","attemptId":"sample-p2-seq","pairNumber":2,"receiptDigest":"sha256:5555555555555555555555555555555555555555555555555555555555555555","terminalStatus":"green","workloadId":"sample"},{"arm":"sequential","attemptId":"sample-p3-seq","pairNumber":3,"receiptDigest":"sha256:6666666666666666666666666666666666666666666666666666666666666666","terminalStatus":"green","workloadId":"sample"},{"arm":"parallel","attemptId":"sample-p3-par","pairNumber":3,"receiptDigest":"sha256:7777777777777777777777777777777777777777777777777777777777777777","terminalStatus":"green","workloadId":"sample"},{"arm":"parallel","attemptId":"sample-p4-par","pairNumber":4,"receiptDigest":"sha256:8888888888888888888888888888888888888888888888888888888888888888","terminalStatus":"green","workloadId":"sample"},{"arm":"sequential","attemptId":"sample-p4-seq","pairNumber":4,"receiptDigest":"sha256:9999999999999999999999999999999999999999999999999999999999999999","terminalStatus":"green","workloadId":"sample"},{"arm":"sequential","attemptId":"sample-p5-seq","pairNumber":5,"receiptDigest":"sha256:aaaaaaaaaaaaaaaaaaaaaaaaaaaaaaaaaaaaaaaaaaaaaaaaaaaaaaaaaaaaaaaa","terminalStatus":"green","workloadId":"sample"},{"arm":"parallel","attemptId":"sample-p5-par","pairNumber":5,"receiptDigest":"sha256:bbbbbbbbbbbbbbbbbbbbbbbbbbbbbbbbbbbbbbbbbbbbbbbbbbbbbbbbbbbbbbbb","terminalStatus":"green","workloadId":"sample"}],"controlsDigest":"sha256:d2fefbcdc94d92ae01e599a714b07bcdc74c7a215907dff9aa52a0b45211a73a","eventLedger":{"firstSequence":1,"lastSequence":200,"terminalHash":"sha256:dddddddddddddddddddddddddddddddddddddddddddddddddddddddddddddddd"},"schemaVersion":"compass-builder.benchmark-aggregate.v1","workloadControls":[{"controls":{"acceptanceCheckDigest":"sha256:c4773639e4181316df56e0a58dee27445b6eb0094737ee05682e81447055691f","acceptanceChecks":["All repository tests pass with a clean tree."],"codexVersion":"codex-cli 1.2.3","concurrencyCeiling":2,"controllerVersion":"compass-builder.controller.v1","cpuCount":8,"effortPolicyVersion":"plugin-compass.effort-policy.v1","environmentDigest":"sha256:1111111111111111111111111111111111111111111111111111111111111111","exactModel":"gpt-5.6-sol","fixtureDigest":"sha256:aaaaaaaaaaaaaaaaaaaaaaaaaaaaaaaaaaaaaaaaaaaaaaaaaaaaaaaaaaaaaaaa","gitVersion":"git version 2.51.0.windows.1","handoffDigests":[{"digest":"sha256:cccccccccccccccccccccccccccccccccccccccccccccccccccccccccccccccc","storyId":"alpha"},{"digest":"sha256:dddddddddddddddddddddddddddddddddddddddddddddddddddddddddddddddd","storyId":"beta"}],"initialEfforts":[{"effort":"low","storyId":"alpha"},{"effort":"medium","storyId":"beta"}],"nonModePlanDigest":"sha256:eeeeeeeeeeeeeeeeeeeeeeeeeeeeeeeeeeeeeeeeeeeeeeeeeeeeeeeeeeeeeeee","orderedStories":["alpha","beta"],"orderedStorySetDigest":"sha256:b30e0ba36ef12372de4d4385e1795ef8b561daa37e0bd9927fd2c9caaa7561e4","os":"Windows 11","promptVersion":"compass-builder.prompt.v1","pythonVersion":"3.11.9","specDigest":"sha256:bbbbbbbbbbbbbbbbbbbbbbbbbbbbbbbbbbbbbbbbbbbbbbbbbbbbbbbbbbbbbbbb","startSha":"aaaaaaaaaaaaaaaaaaaaaaaaaaaaaaaaaaaaaaaa","timeoutMs":600000,"toolchainDigest":"sha256:2222222222222222222222222222222222222222222222222222222222222222"},"workloadId":"sample"}],"workloadManifest":{"pairCount":5,"schemaVersion":"compass-builder.benchmark-workloads.v1","workloads":[{"baseSha":"aaaaaaaaaaaaaaaaaaaaaaaaaaaaaaaaaaaaaaaa","fixtureDigest":"sha256:aaaaaaaaaaaaaaaaaaaaaaaaaaaaaaaaaaaaaaaaaaaaaaaaaaaaaaaaaaaaaaaa","pairs":[{"arms":[{"arm":"sequential","attemptId":"sample-p1-seq"},{"arm":"parallel","attemptId":"sample-p1-par"}],"pairNumber":1},{"arms":[{"arm":"parallel","attemptId":"sample-p2-par"},{"arm":"sequential","attemptId":"sample-p2-seq"}],"pairNumber":2},{"arms":[{"arm":"sequential","attemptId":"sample-p3-seq"},{"arm":"parallel","attemptId":"sample-p3-par"}],"pairNumber":3},{"arms":[{"arm":"parallel","attemptId":"sample-p4-par"},{"arm":"sequential","attemptId":"sample-p4-seq"}],"pairNumber":4},{"arms":[{"arm":"sequential","attemptId":"sample-p5-seq"},{"arm":"parallel","attemptId":"sample-p5-par"}],"pairNumber":5}],"specDigest":"sha256:bbbbbbbbbbbbbbbbbbbbbbbbbbbbbbbbbbbbbbbbbbbbbbbbbbbbbbbbbbbbbbbb","warmups":[{"arm":"sequential","attemptId":"sample-warm-seq"},{"arm":"parallel","attemptId":"sample-warm-par"}],"workloadId":"sample"}]},"workloadManifestDigest":"sha256:cc9cb5a9399f399b96337af025cdcf399c620e05ed5f16fbe4398a1646710924"}
